uid,body,title,url,newspaper_uid,host,n_token_title,n_token_body
7b99c3010e7a963c78d0313cf98f10f6,"Ciclistas de diferentes municipios hicieron presencia en la explanada del parque Zaragoza, arrancando la travesía a las 9:3 de la mañana, para cruzar por localidades de Tepetzingo, Tlavictepan, Sochibebeca, Sábanas, col. Xacotla, finalizando con un bonito convivió en el campo Centenario de béisbol.En su paso atravesaron fincas, ríos, potreros, cañales, lomas, bosques, todo con el fin de que los presentes, conocieran la zona turística de la región de las altas montañas.Los visitantes llegaron de diferentes puntos, como Córdoba, Orizaba, Mendoza, Chocaman, Coscomatepec, Col. Manuel González, Veracruz, R. Cabada, Tlaltetela, etc.Cabe resaltar que este evento deportivo fue organizado por un grupo de ciclistas huatusqueños, que año con año han logrado sacar adelante la travesía, reconociendo que, en esta participación, fueron apoyados por el Ayuntamiento de Huatusco, por parte de la alcaldesa Baldinucci Tejeda Colorado.","En Huatusco, 35 ciclistas participan en la Quinta Edición de Confraternidad Ciclista ","http://huatusconoticias.com/portal//portal/index.php/deportes/53-nota-deportiva/4676-en-huatusco,-350-ciclistas-participan-en-la-quinta-edición-de-confraternidad-ciclista.html",huatusco,huatusconoticias.com,7,75
a70b2715a808ccc8f6fc0703fdccbe47,"El accidente ocurrió al filo de las 9 de la noche, cuando un Nissan Datsun, modelo 1978, con placas XW95 651 del estado, que era conducido por Cristino González de la comunidad de Galera Quemada, se impactó contra un camión Freightliner, de la empresa de Super Pollo de Neria, que trasportaba pollos.El percance se suscitó metros antes de llegar al campo deportivo de Sabanas, donde se encuentra la curva, lugar donde impactaron la unidad, quedando el Datsun completamente destrozado y el conductor prensado en el interior de carro.Al lugar arribaron paramédicos de la Cruz Roja quienes brindaron los primeros auxilios y trasladaron al herido hasta el Hospital, también llegaron elementos de Protección Civil y Policía Estatal.El tramo se encuentra bloqueado en ambos sentidos, pues las unidades quedaron sobre los carriles de subida y bajada, por lo tanto, en estos momentos no hay circulación vial, hasta el arribo de la Policía Federal de Caminos."," Se registra fuerte accidente en Sabanas, una persona prensada","http://huatusconoticias.com/portal//portal/index.php/nota-roja/22-nota-policiaca/4238-se-registra-fuerte-accidente-en-sabanas,-una-persona-prensada.html",huatusco,huatusconoticias.com,6,74
49ec3d857d421df53e368653f6ec1e10," La diputada panista alertó a las autoridades de los tres órdenes de gobierno que la situación de contingencia sanitaria obliga a las personas a quedarse en casa, y en los casos donde ya existe una situación de riesgo de violencia, esta tiende a acrecentarse por el mayor tiempo de convivencia que las mujeres tienen con sus prejas.Lagunes Jáuregui dijo que “el confinamiento trae consigo restricciones que provocan otro tipo de limitaciones y ponen en situación de riesgo a las mujeres por diversas razones: no pueden salir a pedir ayuda, económicamente dependen de su agresor, acuden a mecanismos de sumisión, como quedarse calladas para evitar problemas, además de que el encierro favorece al agresor, para mantenerse en la impunidad”. La legisladora expresó que en los hogares donde los espacios son pequeños, limita el margen de acción de las mujeres para defenderse, lo que las mantiene en estado de ansiedad y estrés. En este contexto, Nora Lagunes hizo un llamado a las autoridades a incorporar la perspectiva de género en las políticas públicas de seguridad pública ante este aislamiento, es decir, considerar que el encierro afecta de manera diferenciada a mujeres y hombres; y estar alertas ante cualquier llamada de urgencia y acudir con la prontitud que un caso de violencia amerita. Recordemos que en el año 219, nuestro estado ocupó el primer lugar a nivel nacional en feminicidios con 159 mujeres asesinadas, no podemos permitir que este aislamiento cueste vidas, enfatizó la diputada integrante de la Comisión Permanente para la Igualdad de Género. La legisladora expresó que el Instituto Veracruzano de las Mujeres cuenta con personal especializado, donde se brinda atención, acompañamiento a las instancias correspondientes y en su caso, resguardo en el Refugio para Mujeres en Situación de Violencia. Puedes llamar al 75 Línea de la Mujer; 8968537; al  911 y al  89 denuncia anónima. Pidió a las y los veracruzanos promover que este tiempo de aislamiento sea para fortalecer las relaciones familiares y fomentar una vida armónica, libre de todo tipo de violencia.","Diputada Nora Lagunes, alerta que aislamiento por COVID-19 podría aumentar casos de violencia contra las mujeres","http://huatusconoticias.com/portal//portal/index.php/estatal-y-nacional/33-personal-tech/5107-diputada-nora-lagunes,-alerta-que-aislamiento-por-covid-19-podría-aumentar-casos-de-violencia-contra-las-mujeres.html",huatusco,huatusconoticias.com,10,165
4be5d8427d0122cf6069ca12e9564994,"La persecución de Garrido contra los católicos incluyó la muerte de sacerdotes, clausura de todas las iglesias en Tabasco, obligar a los sacerdotes a casarse y la prohibición del uso de la cruz en las tumbas. Todos los sacerdotes que no contrajeran matrimonio fueron puestos fuera de la ley en el estado y sus vidas estuvieron en riesgo. Cosas similares ocurrían en Veracruz, pero además la violencia se recrudecía por los movimientos agraristas que eran fomentados desde el gobierno al grado tal que el mismo gobernador dotaba de armas a los grupos que con tal de verse favorecidos formaban grupos de apoyo al gobernador secundando sus acciones anticlericales y de hostilidad a los católicos. Esto que contaré ocurrió un día 9 de junio del año que se menciona al principio, el sacerdote José de Jesús Camo era párroco de la Colonia Manuel González y en aquella ocasión había acudido a la comunidad de Peregrina, congregación de Chavaxtla, a oficiar una misa y realizar unas primeras comuniones. Al pardear la tarde montó en su caballo y tomó el camino de retorno a su parroquia, más su destino ya estaba marcado. Desde hacía un buen rato se habían apostado en la entrada de Chavaxtla, en la desviación que se dirige a La Peregrina un grupo de aproximadamente ocho hombres entre los que se encontraban los hermanos Laureano, Isauro y Luis Castelán Martínez, todos oriundos de Chavaxtla y todos violentos anticlericales y perseguidores de la religión. Entre risotadas y escupitajos bebían alcohol y fumaban confiados en que su plan daría resultado, no hacía falta mucha planeación, el lugar en donde estaban era la única salida por donde tenía que pasar el sacerdote quien, ajeno a lo que se maquinaba, avanzaba a paso lento sobre su cabalgadura en el difícil y pedregoso camino. La tarde era muy calurosa como corresponde a esas latitudes y por una razón que nadie se ha explicado el sacerdote avanzaba completamente solo. Los hombres escucharon el avance de la cabalgadura a la distancia y haciendo solo algunas señas cada uno se fue a apostar al sitio que previamente habían escogido. El cura avanzó ajeno al peligro que le amenazaba y cuando menos lo esperaba se escucharon los disparos dirigidos a su humanidad. El padre cayó de su caballo con algunos disparos en el cuerpo mientras que su cabalgadura salió corriendo con algunas heridas también. Todo sucedió tan rápido que no hubo manera de defender al cura. Los hombres se miraron entre sí como sorprendido por haber realizado tal acción que no atinaban a moverse, solo Laureano se aproximó con un revolver para rematar al hombre herido. Fue entonces que el padre Camo levantó la mano con el instinto de protegerse diciéndole al matón: -Ya no me pegues hijo. Su súplica fue inútil, el hombre accionó su arma y cuenta la tradición que los plomos no atravesaron la mano del sacerdote, que todas las balas quedaron en su palma. Fue entonces que una mujer cuyo nombre ha quedado en el olvido, al darse cuenta de la agresión al sacerdote, corrió y se aventó sobre el herido cubriéndolo con su cuerpo. Entonces, aquellos sanguinarios, tomaron palos de café para golpear a la samaritana hasta causarle la muerte. Creyendo muertos a los dos, los hombres emprendieron la retirada. Cuentan quienes llegaron después a auxiliar al padre y a la mujer que en los maderos de café se quedaron impregnados trozos del cerebro y cabellos de aquella mártir. La señora estaba muerta pero el sacerdote se encontraba con vida. Fue trasladado a Huatusco peo no pudo restablecerse de sus terribles heridas y entregó su alma el día 19 de junio de 1931 a las 14:15 de la tarde. El padre José de Jesús Camo era nativo de Totutla y había nacido el 16 de abril de 1875. Su sepelio se realizó al día siguiente desatándose un zafarrancho tan violento que dejó muchos muertos pero esa… es otra historia.","A 88 años, el crimen del Padre Camo en Chavaxtla ",http://huatusconoticias.com/portal//portal/index.php/especiales/4045-a-88-años-del-crimen-del-padre-camo-en-chavaxtla.html,huatusco,huatusconoticias.com,5,320
30a9049c6429407683735996d8b5a21b,"Prestadores de servicios turísticos, y pobladores de las comunidades que participaron en la reforestación hace 25 años, denunciaron que al menos tres familias han sistematizado tala clandestina del bosque para obtener recursos de manera fácil e ilícita.Los denunciantes pidieron hacer efectivas las políticas públicas de gobierno de Andrés Manuel López Obrador para sancionar con castigos ejemplares a los taladores y que se apliquen operativos con el Ejército Mexicano, toda vez que la Comisión Nacional Forestal, la Comisión Nacional de Areas Naturales Protegidas, la Procuraduría Federal de Protección Ambiental y la Secretará del Medio Ambiente no han podido frenar el problema que impacta a todos.Las cuadrillas de “peloneros” -sobrenombre que reciben los talamontes porque dejan pelón el bosque- con moto sierras, bestias de carga y camionetas de toneladas son capaces de talar hasta 4 árboles por jornada, madera que llega de manera clandestina a los aserraderos de Ciudad Mendoza para convertirse en tarimas de carga.De acuerdo a los denunciantes, quienes piden el anonimato por temor a que los grupos de taladores portan armas, señalaron que las familias de apellidos Alarcón, Vázquez y Morales operan el ilícito con cuadrillas que depredan dentro y fuera del Parque Nacional Pico de Orizaba, principalmente en las comunidades de Xometla, El Paso, El Comal, Potrero Nuevo, La Ciénega y Rancho Nuevo en el municipio de La Perla.En la época de los 9s se realizó una gran campaña encabeza por el Gobierno de Veracruz, IMSS Coplamar, asociaciones civiles y pobladores de San José Pilancón en el municipio de Mariano Escobedo, así como comuneros de San Miguel, Chinalá, Potrero Nuevo, San y San Miguel Pilancón en la Perla para reforestar más de tres mil hectáreas, que ahora son devastadas por los taladores sin que los árboles alcancen una talla maderable siquiera. Muere Glaciar Jamapa La constante depredación de la cubierta forestal del Pico de Orizaba o Citlaltépetl muestra sus efectos directos en la gradual muerte del único glaciar de la montaña, el Jamapa que en este año registra un aumento de su deshielo a través del fenómeno de alpinagua.Alpinagua es el periodo diario de deshielo del glaciar que hace apenas dos años, tenía una duración de cuatro horas, en este año su lapso de derrama es de 12 horas, lo que significa un acelerado proceso de muerte de único glaciar vivo, según especialistas consultados.La atracción de agua por parte de la montaña para procesarla y devolverla a las partes bajas depende la cubierta forestal que sufre amputaciones diarias y cada vez más aceleradas sin que autoridad alguna detenga el fenómeno.Los denunciantes pidieron la intervención de autoridades del Ejército Mexicano y la Fiscalía General de la República para hacer operativos y desalentar a los depredadores, a la par que el Programa del Gobierno de México, Sembrando Vida se intensifique y privilegie para la montaña más alta de México que además es la fábrica agua para miles de habitantes de los estados de Veracruz y Puebla.","Se dispara deforestación en el Pico de Orizaba, talan 12 Hectáreas de marzo a mayo","http://huatusconoticias.com/portal//portal/index.php/especiales/3966-se-dispara-deforestación-en-el-pico-de-orizaba,-talan-120-hectáreas-de-marzo-a-mayo.html",huatusco,huatusconoticias.com,8,263
e0cd16d1959d1efda40dc1676ca97913,"Fue al filo de las 11:3 horas, que el Delegación de Águilas Negras reportó el incendió de un trapiche que se encuentra a 5 metros del Jardín de Niños, por lo cual, se trasladaron al lugar elementos de la Policía Municipal, Protección Civil y Bomberos.Los primero que empezó a incendiarse fue el bagazo que se encontraba junto a la hornalla, pues debido al calor ardió, posteriormente se extendió hacia todo el bagazo consumiendo por completo el trapiche.Los cuerpos de auxilio y vecinos batallaron por varias horas hasta el transcurso de la madrugada cuando el fuego fue contralado aunque toda la galera se quemó, afortunadamente no hay lesionados.    ", Se incendia trapiche en Cotecontla,http://huatusconoticias.com/portal//portal/index.php/nota-roja/22-nota-policiaca/1574-se-incendia-trapiche-en-cotecontla.html,huatusco,huatusconoticias.com,3,52
9e17be3d834e4239958702d4373d68f2,"Las inscripciones son gratuitas y están abiertas en las oficinas de la dependencia municipal de 8 de la mañana a 3 de la tarde , de lunes a viernes.El lunes 9 de diciembre a partir de las 5 de la tarde se llevará a cabo la acción deportiva en las ramas varonil y femenil. Categorías libre de 15 a 35 años, máster de 36 a 49 años y veteranos de 5 años en adelante.Habrá premios para los participantes; categoria libre primer lugar 7 pesos, segundo lugar 5 pesos y tercer lugar 3 pesos.Para la categoría máster los premios se detallan de la siguiente manera; primer lugar 5 pesos, segundo lugar 3 pesos y tercer lugar 2 pesos.Finalmente para la categoría de veteranos los premios son; primer lugar 5 pesos, segundo lugar 3 pesos y tercer lugar 2 pesos.Las inscripciones ya se encuentran abiertas y se cerrarán el 6 de diciembre, los requistos que debe llevar para inscribirse son ; copia de credencial de elector y firmar una responsiva.","Comude Huatusco, Te invita al evento deportivo, "" Corre, camina o trota"" al Cerrito de Guadalupe.","http://huatusconoticias.com/portal//portal/index.php/deportes/53-nota-deportiva/4743-comude-huatusco,-te-invita-al-evento-deportivo,-corre,-camina-o-trota-al-cerrito-de-guadalupe.html",huatusco,huatusconoticias.com,10,78
